[
  {
    "id": "docker-daemon-not-running",
    "language": "docker",
    "title": "Cannot connect to the Docker daemon",
    "matcher": {
      "type": "regex",
      "pattern": "Cannot connect to the Docker daemon"
    },
    "jokes": [
      "Docker Desktop isn't running. It never is, when you need it.",
      "The Docker daemon is asleep and you didn't wake it up.",
      "You ran a docker command with no daemon listening. Classic.",
      "Docker is not running. Have you tried turning it on?",
      "This is the docker equivalent of yelling into an empty room."
    ],
    "fix": {
      "summary": "Start Docker Desktop or the docker daemon service.",
      "command": "open -a Docker"
    },
    "personality_tag": "setup",
    "tags": [
      "setup"
    ],
    "vibes": {
      "sarcastic-senior-dev": [
        "Docker Desktop isn't running. It never is. Start it and try again like the rest of us.",
        "The daemon's down. Open Docker Desktop, wait the obligatory thirty seconds, retry."
      ]
    }
  },
  {
    "id": "docker-port-already-allocated",
    "language": "docker",
    "title": "port is already allocated",
    "matcher": {
      "type": "regex",
      "pattern": "Bind for [\\d.]+:(\\d+) failed: port is already allocated"
    },
    "slots": {
      "1": "port"
    },
    "jokes": [
      "Port {port} is already claimed by another container. Or the last one you forgot to stop.",
      "You have a zombie container squatting on port {port}.",
      "Port {port} is taken, probably by yesterday's forgotten `docker run`.",
      "This container wants port {port}, but so does something you already started.",
      "You have too many containers and not enough ports."
    ],
    "fix": {
      "summary": "Stop the container using that port, or map to a different one.",
      "command": "docker ps --filter publish={port}"
    },
    "personality_tag": "network",
    "tags": [
      "network"
    ],
    "vibes": {
      "sarcastic-senior-dev": [
        "Port {port} is already bound. Probably to the container you forgot to stop last time.",
        "Something's already on {port}. docker ps will tell you what. Check before you complain."
      ]
    }
  },
  {
    "id": "docker-image-not-found",
    "language": "docker",
    "title": "pull access denied / image not found",
    "matcher": {
      "type": "regex",
      "pattern": "pull access denied for ([\\w./-]+)"
    },
    "slots": {
      "1": "image"
    },
    "jokes": [
      "'{image}' doesn't exist, or it's private and you're not invited.",
      "Docker Hub has no idea what '{image}' is.",
      "You're pulling '{image}' and getting nothing but rejection.",
      "That image name is either misspelled or belongs to someone else's registry.",
      "'{image}': pull denied, dreams denied."
    ],
    "fix": {
      "summary": "Check the image name/tag, and log in if it's a private registry.",
      "command": "docker login"
    },
    "personality_tag": "dependency",
    "tags": [
      "dependency"
    ]
  },
  {
    "id": "docker-no-space-left",
    "language": "docker",
    "title": "no space left on device",
    "matcher": {
      "type": "regex",
      "pattern": "no space left on device"
    },
    "jokes": [
      "Docker has quietly eaten your entire disk with old layers.",
      "No space left on device: every image you never pruned is now haunting you.",
      "Your disk is full of dangling images from six months ago.",
      "This is what happens when you never run docker system prune.",
      "Docker's cache grew into a monster and it just ate your free space."
    ],
    "fix": {
      "summary": "Prune unused Docker images, containers, and volumes.",
      "command": "docker system prune -af"
    },
    "personality_tag": "resource",
    "tags": [
      "resource"
    ],
    "vibes": {
      "sarcastic-senior-dev": [
        "No disk space left. Docker's been hoarding old images and layers for months. Run a prune.",
        "You're out of space. This happens to everyone who's never run docker system prune."
      ]
    }
  },
  {
    "id": "docker-container-exited-nonzero",
    "language": "docker",
    "title": "container exited with non-zero code",
    "matcher": {
      "type": "regex",
      "pattern": "exited with code (\\d+)"
    },
    "slots": {
      "1": "code"
    },
    "jokes": [
      "Your container exited with code {code}. It had thoughts and they were bad.",
      "Exit code {code}: the container's way of saying something went wrong inside.",
      "That container ran, then immediately regretted it. Exit {code}.",
      "Container exit code {code}. Time to check the logs.",
      "The entrypoint failed and left exit code {code} as evidence."
    ],
    "fix": {
      "summary": "Check the container logs for the real error.",
      "command": "docker logs <container>"
    },
    "personality_tag": "runtime",
    "tags": [
      "runtime"
    ]
  },
  {
    "id": "npm-eresolve",
    "language": "npm",
    "title": "npm ERR! ERESOLVE",
    "matcher": {
      "type": "regex",
      "pattern": "npm ERR! ERESOLVE"
    },
    "jokes": [
      "npm found conflicting dependency requirements and gave up trying to guess.",
      "ERESOLVE: your dependency tree is arguing with itself.",
      "Two packages want different versions of the same thing. npm refuses to referee.",
      "This is the price of a deep and tangled node_modules tree.",
      "npm's dependency resolver just threw its hands up."
    ],
    "fix": {
      "summary": "Resolve manually, or retry with --legacy-peer-deps if appropriate.",
      "command": "npm install --legacy-peer-deps"
    },
    "personality_tag": "dependency",
    "tags": [
      "dependency"
    ]
  },
  {
    "id": "npm-enoent-package-json",
    "language": "npm",
    "title": "ENOENT: no such file or directory, open 'package.json'",
    "matcher": {
      "type": "regex",
      "pattern": "ENOENT.*package\\.json"
    },
    "jokes": [
      "There's no package.json here. You're not in a Node project, or not in the right folder.",
      "npm looked for package.json and found empty air.",
      "This directory has no package.json. It never claimed to be a Node project.",
      "You ran npm somewhere that isn't a Node project. Bold move.",
      "package.json is missing. So is the plan."
    ],
    "fix": {
      "summary": "cd into the project root, or run npm init if starting fresh.",
      "command": "npm init -y"
    },
    "personality_tag": "setup",
    "tags": [
      "setup"
    ]
  },
  {
    "id": "npm-permission-denied-global",
    "language": "npm",
    "title": "EACCES permission denied",
    "matcher": {
      "type": "regex",
      "pattern": "npm ERR! code EACCES"
    },
    "jokes": [
      "npm wants root, or at least ownership of its own directories.",
      "EACCES: npm's global install directory doesn't trust you.",
      "You tried a global install without the right permissions. Classic npm rite of passage.",
      "Permission denied. npm's global folder has trust issues, usually because you once used sudo.",
      "This is the direct result of installing Node with sudo at some point in your life."
    ],
    "fix": {
      "summary": "Fix npm's global directory ownership rather than using sudo.",
      "command": "npm config get prefix"
    },
    "personality_tag": "permissions",
    "tags": [
      "permissions"
    ]
  },
  {
    "id": "pip-could-not-find-version",
    "language": "pip",
    "title": "Could not find a version that satisfies the requirement",
    "matcher": {
      "type": "regex",
      "pattern": "Could not find a version that satisfies the requirement ([\\w.\\-\\[\\]]+)"
    },
    "slots": {
      "1": "package"
    },
    "jokes": [
      "'{package}' doesn't exist on PyPI, at least not with that name or version.",
      "pip searched everywhere for '{package}' and found nothing that fits.",
      "'{package}': not on PyPI, not in your Python version's compatibility range, not happening.",
      "You asked pip for a version of '{package}' that simply isn't published.",
      "This is either a typo or a version that was never released."
    ],
    "fix": {
      "summary": "Check the package name/version and your Python version compatibility.",
      "command": "pip index versions {package}"
    },
    "personality_tag": "dependency",
    "tags": [
      "dependency"
    ]
  },
  {
    "id": "pip-externally-managed-environment",
    "language": "pip",
    "title": "externally-managed-environment",
    "matcher": {
      "type": "regex",
      "pattern": "externally-managed-environment"
    },
    "jokes": [
      "Your system Python is protected from itself, and now from you too.",
      "pip refuses to install globally into a system-managed Python. This is a feature.",
      "Modern Python is tired of you breaking your OS packages. Use a venv.",
      "This is PEP 668 telling you, politely but firmly, to use a virtual environment.",
      "System Python said no. It's not personal, it's PEP 668."
    ],
    "fix": {
      "summary": "Use a virtual environment instead of installing into system Python.",
      "command": "python -m venv .venv && source .venv/bin/activate"
    },
    "personality_tag": "setup",
    "tags": [
      "setup",
      "venv"
    ]
  },
  {
    "id": "docker-compose-version-mismatch",
    "language": "docker",
    "title": "docker-compose version unsupported",
    "matcher": { "type": "regex", "pattern": "Version in \".*docker-compose\\.ya?ml\" is unsupported" },
    "jokes": [
      "Your compose file claims a version that this Compose install has never heard of.",
      "docker-compose and your compose.yml disagree on what year it is.",
      "That version key is either too old or too new for the Compose binary you have.",
      "This is a compatibility mismatch between the compose spec and your installed tooling.",
      "Someone wrote this file for a different Compose than the one running it.",